{
  "source": {
    "format": "pdf",
    "accessMode": "extracted_text",
    "locator": "source.txt",
    "licenseOrUseNote": "Fixture content."
  },
  "scope": {
    "section": "PDF Excerpt"
  },
  "design_mode": "chapter_tutorial",
  "learner_preferences": {
    "familiarity": "novice",
    "goal": "practice",
    "audience": "beginner",
    "target_domain": "general",
    "explanation_preference": "balanced",
    "time_budget_minutes": 20
  }
}
